{"adapter_id":"qwen-code","provider":"provider-neutral","adapter_version":"1.0.0","runtime":{"runtime_id":"qwen-code","runtime_version":"0.22.3"},"resolution":"lazy","runtime_contract":{"runtime_id":"qwen-code","destination":".qwen/skills/","activation":"lazy","settings_provenance":"required","hooks":"explicit_opt_in","mcp":"explicit_opt_in","fallback":"provider-neutral"},"capabilities":{"artifact_identity":true,"command_execution":true,"durable_state":true,"measurement_capture":false}}
