{"adapter_id":"claude-code","provider":"provider-neutral","adapter_version":"1.0.0","runtime":{"runtime_id":"claude-code","runtime_version":"2.1.251"},"resolution":"lazy","runtime_contract":{"runtime_id":"claude-code","destination":".claude/skills/","activation":"lazy","settings_provenance":"required","hooks":"explicit_opt_in","mcp":"explicit_opt_in","fallback":"provider-neutral"},"capabilities":{"artifact_identity":true,"command_execution":true,"durable_state":true,"measurement_capture":false}}
